{
  "schema_version": 1,
  "sdk": "@upstash/box@0.6.3",
  "source_commit": "677ca0827a6f54bc328b4b3e97d32a7cc5ac1934",
  "generated_from": [
    {
      "path": "route-manifest.json",
      "sha256": "97cd48ffa125aee88457c219700b56ffa27071fb7739ecb94fac1d82997a8ef4"
    },
    {
      "path": "public-case-registry.mjs",
      "sha256": "85fc4e79a936ebf185829d662db3602d81dad059e9f009c36a04dc509ab5f4bb"
    }
  ],
  "summary": {
    "contracts": 78,
    "public_cases": 82,
    "uncovered_contracts": 0
  },
  "contracts": [
    {
      "contract_id": "DELETE /v2/box",
      "method": "DELETE",
      "path": "/v2/box",
      "relation": "direct",
      "case_ids": [
        "DELETE /v2/box"
      ]
    },
    {
      "contract_id": "DELETE /v2/box/{box_id}",
      "method": "DELETE",
      "path": "/v2/box/{box_id}",
      "relation": "direct",
      "case_ids": [
        "DELETE /v2/box/{box_id}"
      ]
    },
    {
      "contract_id": "DELETE /v2/box/{box_id}/browser/tabs/{tab_id}",
      "method": "DELETE",
      "path": "/v2/box/{box_id}/browser/tabs/{tab_id}",
      "relation": "direct",
      "case_ids": [
        "DELETE /v2/box/{box_id}/browser/tabs/{tab_id}"
      ]
    },
    {
      "contract_id": "DELETE /v2/box/{box_id}/config/labels/{label}",
      "method": "DELETE",
      "path": "/v2/box/{box_id}/config/labels/{label}",
      "relation": "direct",
      "case_ids": [
        "DELETE /v2/box/{box_id}/config/labels/{label}"
      ]
    },
    {
      "contract_id": "DELETE /v2/box/{box_id}/config/skills/{skill_id+}",
      "method": "DELETE",
      "path": "/v2/box/{box_id}/config/skills/{skill_id+}",
      "relation": "direct",
      "case_ids": [
        "DELETE /v2/box/{box_id}/config/skills/{skill_id+}"
      ]
    },
    {
      "contract_id": "DELETE /v2/box/{box_id}/preview/{port}",
      "method": "DELETE",
      "path": "/v2/box/{box_id}/preview/{port}",
      "relation": "direct",
      "case_ids": [
        "DELETE /v2/box/{box_id}/preview/{port}"
      ]
    },
    {
      "contract_id": "DELETE /v2/box/{box_id}/schedules/{id}",
      "method": "DELETE",
      "path": "/v2/box/{box_id}/schedules/{id}",
      "relation": "direct",
      "case_ids": [
        "DELETE /v2/box/{box_id}/schedules/{id}"
      ]
    },
    {
      "contract_id": "DELETE /v2/box/{box_id}/snapshots/{snapshot_id}",
      "method": "DELETE",
      "path": "/v2/box/{box_id}/snapshots/{snapshot_id}",
      "relation": "direct",
      "case_ids": [
        "DELETE /v2/box/{box_id}/snapshots/{snapshot_id}"
      ]
    },
    {
      "contract_id": "DELETE /v2/box/{box_id}/startup",
      "method": "DELETE",
      "path": "/v2/box/{box_id}/startup",
      "relation": "direct",
      "case_ids": [
        "DELETE /v2/box/{box_id}/startup"
      ]
    },
    {
      "contract_id": "DELETE /v2/box/settings/env/{key}",
      "method": "DELETE",
      "path": "/v2/box/settings/env/{key}",
      "relation": "direct",
      "case_ids": [
        "DELETE /v2/box/settings/env/{key}"
      ]
    },
    {
      "contract_id": "DELETE /v2/box/snapshots",
      "method": "DELETE",
      "path": "/v2/box/snapshots",
      "relation": "direct",
      "case_ids": [
        "DELETE /v2/box/snapshots"
      ]
    },
    {
      "contract_id": "GET /v2/box",
      "method": "GET",
      "path": "/v2/box",
      "relation": "direct",
      "case_ids": [
        "GET /v2/box"
      ]
    },
    {
      "contract_id": "GET /v2/box/{box_id}",
      "method": "GET",
      "path": "/v2/box/{box_id}",
      "relation": "direct",
      "case_ids": [
        "GET /v2/box/{box_id}",
        "GET /v2/box/{box_id}#labels",
        "GET /v2/box/{box_id}#skills"
      ]
    },
    {
      "contract_id": "GET /v2/box/{box_id}/browser/content",
      "method": "GET",
      "path": "/v2/box/{box_id}/browser/content",
      "relation": "direct",
      "case_ids": [
        "GET /v2/box/{box_id}/browser/content"
      ]
    },
    {
      "contract_id": "GET /v2/box/{box_id}/browser/recordings",
      "method": "GET",
      "path": "/v2/box/{box_id}/browser/recordings",
      "relation": "direct",
      "case_ids": [
        "GET /v2/box/{box_id}/browser/recordings"
      ]
    },
    {
      "contract_id": "GET /v2/box/{box_id}/browser/recordings/{id}",
      "method": "GET",
      "path": "/v2/box/{box_id}/browser/recordings/{id}",
      "relation": "direct",
      "case_ids": [
        "GET /v2/box/{box_id}/browser/recordings/{id}"
      ]
    },
    {
      "contract_id": "GET /v2/box/{box_id}/browser/recordings/{id}/download",
      "method": "GET",
      "path": "/v2/box/{box_id}/browser/recordings/{id}/download",
      "relation": "direct",
      "case_ids": [
        "GET /v2/box/{box_id}/browser/recordings/{id}/download"
      ]
    },
    {
      "contract_id": "GET /v2/box/{box_id}/browser/recordings/{id}/playlist",
      "method": "GET",
      "path": "/v2/box/{box_id}/browser/recordings/{id}/playlist",
      "relation": "response_linked_capability",
      "case_ids": [
        "GET /v2/box/{box_id}/browser/recordings/{id}"
      ]
    },
    {
      "contract_id": "GET /v2/box/{box_id}/browser/screenshot",
      "method": "GET",
      "path": "/v2/box/{box_id}/browser/screenshot",
      "relation": "direct",
      "case_ids": [
        "GET /v2/box/{box_id}/browser/screenshot"
      ]
    },
    {
      "contract_id": "GET /v2/box/{box_id}/browser/tabs",
      "method": "GET",
      "path": "/v2/box/{box_id}/browser/tabs",
      "relation": "direct",
      "case_ids": [
        "GET /v2/box/{box_id}/browser/tabs"
      ]
    },
    {
      "contract_id": "GET /v2/box/{box_id}/files/download",
      "method": "GET",
      "path": "/v2/box/{box_id}/files/download",
      "relation": "direct",
      "case_ids": [
        "GET /v2/box/{box_id}/files/download"
      ]
    },
    {
      "contract_id": "GET /v2/box/{box_id}/files/list",
      "method": "GET",
      "path": "/v2/box/{box_id}/files/list",
      "relation": "direct",
      "case_ids": [
        "GET /v2/box/{box_id}/files/list"
      ]
    },
    {
      "contract_id": "GET /v2/box/{box_id}/files/read",
      "method": "GET",
      "path": "/v2/box/{box_id}/files/read",
      "relation": "direct",
      "case_ids": [
        "GET /v2/box/{box_id}/files/read"
      ]
    },
    {
      "contract_id": "GET /v2/box/{box_id}/git/diff",
      "method": "GET",
      "path": "/v2/box/{box_id}/git/diff",
      "relation": "direct",
      "case_ids": [
        "GET /v2/box/{box_id}/git/diff"
      ]
    },
    {
      "contract_id": "GET /v2/box/{box_id}/git/status",
      "method": "GET",
      "path": "/v2/box/{box_id}/git/status",
      "relation": "direct",
      "case_ids": [
        "GET /v2/box/{box_id}/git/status"
      ]
    },
    {
      "contract_id": "GET /v2/box/{box_id}/logs",
      "method": "GET",
      "path": "/v2/box/{box_id}/logs",
      "relation": "direct",
      "case_ids": [
        "GET /v2/box/{box_id}/logs"
      ]
    },
    {
      "contract_id": "GET /v2/box/{box_id}/preview",
      "method": "GET",
      "path": "/v2/box/{box_id}/preview",
      "relation": "direct",
      "case_ids": [
        "GET /v2/box/{box_id}/preview"
      ]
    },
    {
      "contract_id": "GET /v2/box/{box_id}/runs",
      "method": "GET",
      "path": "/v2/box/{box_id}/runs",
      "relation": "direct",
      "case_ids": [
        "GET /v2/box/{box_id}/runs"
      ]
    },
    {
      "contract_id": "GET /v2/box/{box_id}/schedules",
      "method": "GET",
      "path": "/v2/box/{box_id}/schedules",
      "relation": "direct",
      "case_ids": [
        "GET /v2/box/{box_id}/schedules"
      ]
    },
    {
      "contract_id": "GET /v2/box/{box_id}/schedules/{id}",
      "method": "GET",
      "path": "/v2/box/{box_id}/schedules/{id}",
      "relation": "direct",
      "case_ids": [
        "GET /v2/box/{box_id}/schedules/{id}"
      ]
    },
    {
      "contract_id": "GET /v2/box/{box_id}/snapshots",
      "method": "GET",
      "path": "/v2/box/{box_id}/snapshots",
      "relation": "direct",
      "case_ids": [
        "GET /v2/box/{box_id}/snapshots"
      ]
    },
    {
      "contract_id": "GET /v2/box/{box_id}/startup",
      "method": "GET",
      "path": "/v2/box/{box_id}/startup",
      "relation": "direct",
      "case_ids": [
        "GET /v2/box/{box_id}/startup"
      ]
    },
    {
      "contract_id": "GET /v2/box/{box_id}/status",
      "method": "GET",
      "path": "/v2/box/{box_id}/status",
      "relation": "direct",
      "case_ids": [
        "GET /v2/box/{box_id}/status"
      ]
    },
    {
      "contract_id": "GET /v2/box/settings/env",
      "method": "GET",
      "path": "/v2/box/settings/env",
      "relation": "direct",
      "case_ids": [
        "GET /v2/box/settings/env"
      ]
    },
    {
      "contract_id": "PATCH /v2/box/{box_id}/schedules/{id}",
      "method": "PATCH",
      "path": "/v2/box/{box_id}/schedules/{id}",
      "relation": "direct",
      "case_ids": [
        "PATCH /v2/box/{box_id}/schedules/{id}"
      ]
    },
    {
      "contract_id": "POST /v2/box",
      "method": "POST",
      "path": "/v2/box",
      "relation": "direct",
      "case_ids": [
        "POST /v2/box#ephemeral"
      ]
    },
    {
      "contract_id": "POST /v2/box/{box_id}/browser/act",
      "method": "POST",
      "path": "/v2/box/{box_id}/browser/act",
      "relation": "direct",
      "case_ids": [
        "POST /v2/box/{box_id}/browser/act"
      ]
    },
    {
      "contract_id": "POST /v2/box/{box_id}/browser/connect",
      "method": "POST",
      "path": "/v2/box/{box_id}/browser/connect",
      "relation": "direct",
      "case_ids": [
        "POST /v2/box/{box_id}/browser/connect"
      ]
    },
    {
      "contract_id": "POST /v2/box/{box_id}/browser/extract",
      "method": "POST",
      "path": "/v2/box/{box_id}/browser/extract",
      "relation": "direct",
      "case_ids": [
        "POST /v2/box/{box_id}/browser/extract"
      ]